Nome Trabalho;Nome Evento Cadastrado;Nome Evento Canônico
Perspectives for IoT-Based Integration of Distributed and Automated Manufacturing Lines for Mass Customization;Proceedings on 25th International Joint Conference on Industrial Engineering and Operations Management (IJCIEOM);International Conference on Industrial Engineering and Operations Management
Data Confidence Applied to Wind Turbine Power Curves;Proceedings of the X Brazilian Symposium on Computing Systems Engineering;Brazilian Symposium on Computing System Engineering
A Fault Injection Framework for Real-time Multicore Embedded Systems;Proceedings of the X Brazilian Symposium on Computing Systems Engineering;Brazilian Symposium on Computing System Engineering
R-Extractor: A Method for Data Extraction from Template-Based Entity-Pages;2017 IEEE 41st Annual Computer Software and Applications Conference (COMPSAC);Annual International Computers, Software & Applications Conference
Extracting Records from the Web Using a Signal Processing Approach;Proceedings of the 2017 ACM on Conference on Information and Knowledge Management - CIKM &amp,apos,17;ACM International Conference on Information and Knowledge Management
An Advance Resource Reservation Approach in a Cloud Database Environment;Anais do XVIII Simpósio de Sistemas Computacionais de Alto Desempenho;Simpósio em Sistemas Computacionais de Alto Desempenho
Improving performance in a DBaaS environment through the use of resource reservation;Proceedings of the 19th International Conference on Information Integration and Web-based Applications &amp,amp, Services - iiWAS &amp,apos,17;International Conference on Information Integration and Web-based Applications & Services
Preserving Privacy with Fine-grained Authorization in an Identity Management System;ICN 2017, The Sixteenth International Conference on Networks;INTERNATIONAL CONFERENCE ON NETWORKS
Privacy Token: A Mechanism for User's Privacy Specification in Identity Management Systems for the Cloud;ICN 2017, The Sixteenth International Conference on Networks;INTERNATIONAL CONFERENCE ON NETWORKS
Improving OpenID Connect Federations Interoperability with Web Semantics;2017 IEEE/ACS 14th International Conference on Computer Systems and Applications (AICCSA);ACS/IEEE International Conference on Computer Systems and Applications
Autenticação mútua de nós sensores com nós intermediários para IoT no contexto de Fog Computing;Anais do Workshop de Trabalhos de Iniciação Científica e Graduação (WTG - SBRC 2018);WORKSHOP DE TRABALHOS DE INICIAÇÃO CIENTÍFICA E GRADUAÇÃO
Mutual Authentication for IoT in the Context of Fog Computing;2019 11th International Conference on Communication Systems &amp,amp, Networks (COMSNETS);International Conference on COMmunication Systems & NETworkS
Preserving Privacy with Fine-grained Authorization in an Identity Management System;The Sixteenth International Conference on Networks - ICN 2017;INTERNATIONAL CONFERENCE ON NETWORKS
Autenticação mútua de nós sensores com nós intermediários para IoT no contexto de Fog Computing;Simpósio Brasileiro de Redes de Computadores e Sistemas Distribuídos (SBRC), 2Anais do Workshop de Trabalhos de Iniciação Científica e Graduação (WTG - SBRC 2018);Simpósio Brasileiro de Redes de Computadores e Sistemas Distribuídos
Mutual Authentication for IoT in the Context of Fog Computing;2019 11th International Conference on Communication Systems &amp,amp, Networks (COMSNETS);International Conference on COMmunication Systems & NETworkS
Autonomic IoT Battery Management with Fog Computing;14th International Conference on Green, Pervasive and Cloud Computing;International Conference on Grid And Pervasive Computing
Ambiente de experimentação para avaliação protocolos de mensagem para IoT na Fog;SBRC 2020  WPEIF (Simpósio Brasileiro de Redes de Computadores e Sistemas Distribuídos - Workshop de Pesquisa Experimental da Internet do Futuro);Simpósio Brasileiro de Redes de Computadores e Sistemas Distribuídos
Avaliação de desempenho de protocolos de mensagens com arquitetura publish/subscribe no ambiente de computação em nevoeiro: um estudo sobre desempenho do MQTT, AMQP e STOMP;SBRC 2020  WPEIF (Simpósio Brasileiro de Redes de Computadores e Sistemas Distribuídos - Workshop de Pesquisa Experimental da Internet do Futuro).;Simpósio Brasileiro de Redes de Computadores e Sistemas Distribuídos
Desarrollando competencias personales y habilidades sociales en ingeniería informática mediante el uso de juegos serios;Jornadas sobre Enseñanza Universitaria de la Informática;Jornadas de Enseñanza Universitaria de la Informática
Juegos serios para formar en los conceptos del lenguaje C: una experiencia en Fundamentos de Informática;XXV Jornadas sobre Enseñanza Universitaria de la Informática;Jornadas de Enseñanza Universitaria de la Informática
Uma Análise das Diretrizes para Ensino de Pensamento Computacional propostas pela SBC na Educação Básica;X Reunião da ABAVE;REUNIÃO DA ABAVE
CodeMaster: Um Modelo de Avaliação do Pensamento Computacional na Educação Básica através da Análise de Código de Linguagem de Programação Visual;X Reunião da Abave;REUNIÃO DA ABAVE
CodeMaster UI design - app inventor;Proceedings of the 18th Brazilian Symposium on Human Factors in Computing Systems - IHC '19;Simpósio Brasileiro sobre Fatores Humanos em Sistemas Computacionais
MEEGA+: A Method for the Evaluation of the Quality of Games for Computing Education;Anais do Concurso de Teses e Dissertações da SBGames;CONCURSO DE TESES E DISSERTAÇÕES DA SBGAMES
Uma Análise do Sequenciamento Pedagógico no Ensino de Computação na Educação Básica;Simpósio Brasileiro de Informática na Educação no VIII Congresso Brasileiro de Informática na Educação;Workshops do Congresso Brasileiro de Informática na Educação
A Method for the Evaluation of the Quality of Games for Computing Education;Concurso Alexandre Direne de Teses, Dissertações e Trabalhos de Conclusão no VIII Congresso Brasileiro de Informática na Educação;Workshops do Congresso Brasileiro de Informática na Educação
Um Modelo de Avaliação do Pensamento Computacional na Educação Básica através da Análise de Código de Linguagem de Programação Visual;Concurso Alexandre Direne de Teses, Dissertações e Trabalhos de Conclusão no VIII Congresso Brasileiro de Informática na Educação;Workshops do Congresso Brasileiro de Informática na Educação
Reliability Evaluation of Circuits Designed in Multi- and Single-Stage Versions;LASCAS - IEEE Latin American Symposium on Circuits and Systems 2018;IEEE Latin American Symposium on Circuits and Systems
Simulador de NoCs modelado como um SMA;WESAAC - Workshop-Escola de Sistemas de Agentes, seus Ambientes e Aplicações;Workshop-Escola de Sistemas Agentes, seus Ambientes e apliCações
Comparing 4-bits Adders Topologies on 32nm.;SIM - Simposio Sul de Microeletrônica;SIMPÓSIO SUL DE MICROELETRÔNICA
Evaluation of Variability Through Schmitt Trigger Technique on CMOS Full Adder Layout.;SIM - Simposio Sul de Microeletrônica;SIMPÓSIO SUL DE MICROELETRÔNICA
Analyze of Permanent and Transient Faults in 6T SRAM cell;SIM - Simposio Sul de Microeletrônica;SIMPÓSIO SUL DE MICROELETRÔNICA
PVT variation impact on 16nm SRAM cells;SIM - Simposio Sul de Microeletrônica;SIMPÓSIO SUL DE MICROELETRÔNICA
Investigating Schmitt Trigger Inverters behavior at 16nm technologies;SIM - Simposio Sul de Microeletrônica;SIMPÓSIO SUL DE MICROELETRÔNICA
16nm XOR behavior under PVT variability: Tri-Gate versus bulk CMOS;SIM - Simposio Sul de Microeletrônica;SIMPÓSIO SUL DE MICROELETRÔNICA
Reducing variability impact on 7nm Mirror CMOS Layout;SFORUM - Microelectronics Students Forum;Microelectronics Students Forum
Comparing the Performance of 4-bits Adders Topologies on Sub 32nm Bulk CMOS Technologies;SFORUM - Microelectronics Students Forum;Microelectronics Students Forum
How Different Transistor Arrangements Impact Process Variability and Radiation Effects;SFORUM - Microelectronics Students Forum;Microelectronics Students Forum
Investigating CMOS Inverters Noise Margins at Different Technologic Nodes;SFORUM - Microelectronics Students Forum;Microelectronics Students Forum
Comparing the SEU Robustness of 6T and 8T-SER SRAM cells at 16nm;SFORUM - Microelectronics Students Forum;Microelectronics Students Forum
AVALIAÇÃO DOS EFEITOS DE FALHAS DO TIPO SINGLE EVENT UPSET SOBRE CÉLULAS DE MEMÓRIA SRAM NA TECNOLOGIA DE 16nm;MCSUL - Conferência Sul em Modelagem Computacional;CONFERÊNCIA SUL EM MODELAGEM COMPUTACIONAL
AVALIAÇÃO DE ALGORITMOS DE LEGALIZAÇÃO EM CIRCUITOS VLSI;MCSul - Conferência Sul em Modelagem Computacional;CONFERÊNCIA SUL EM MODELAGEM COMPUTACIONAL
Process Variability Challenges for Radiation Mitigation Techniques on 16nm;10th LASCAS - IEEE Latin American Symposium on Circuits and Systems;IEEE Latin American Symposium on Circuits and Systems
A Library for Services Transparent Replication;SAC - 34th ACM Symposium on Applied Computing, DADS Track;ACM Symposium on Applied Computing
Low Energy and Process Variability Analysis over FinFET Schmitt Trigger Design;WCAS - Workshop on Circuits and System Design;Workshop on Circuits and Systems Design
Performance Evaluation of Arithmetic Blocks at 16nm Technology;WCAS - Workshop on Circuits and System Design;Workshop on Circuits and Systems Design
Radiation Robustness Evaluation on XOR Logic Gates at 16nm CMOS and FinFET Technology;SFORUM - Microelectronics Students Forum;Microelectronics Students Forum
Evaluating Approximated Full Adders at 16nm;SFORUM - Microelectronics Students Forum;Microelectronics Students Forum
Evaluating Energy and Delay of DICE and PDICE SRAM Cells at 32nm Technology;SFORUM - Microelectronics Students Forum;Microelectronics Students Forum
A Comparative Evaluation of SRAM topologies;SFORUM - Microelectronics Students Forum;Microelectronics Students Forum
FinFET Variability and Near-Threshold Operation: Impact on Full Adders Design Using XOR Blocks;26th IEEE International Conference on Electronics Circuits and Systems (ICECS);IEEE International Conference on Electronics, Circuits and Systems
Sleep Transistors to Improve the Process Variability and Soft Error Susceptibility;26th IEEE International Conference on Electronics Circuits and Systems (ICECS);IEEE International Conference on Electronics, Circuits and Systems
FBM: a Simple and Fast Algorithm for Placement Legalization;26th IEEE International Conference on Electronics Circuits and Systems (ICECS);IEEE International Conference on Electronics, Circuits and Systems
Radiation Effects in XOR Logic Gates at 16nm CMOS and FinFET Technology;26th IEEE International Conference on Electronics Circuits and Systems (ICECS);IEEE International Conference on Electronics, Circuits and Systems
Robustness enhancing inverters on Full Adders and Low Power applications;Simpósio Sul de Microeletrônica - SIM;SIMPÓSIO SUL DE MICROELETRÔNICA
Comparative evaluation of Dual Interlocked Cell in 32nm CMOS and 7nm FinFET;Simpósio Sul de Microeletrônica - SIM;SIMPÓSIO SUL DE MICROELETRÔNICA
An Analysis of Voltage Scaling Applied toApproximated Full Adders;Simpósio Sul de Microeletrônica - SIM;SIMPÓSIO SUL DE MICROELETRÔNICA
Bit width Exploration for Energy-efficient Image and Video Processing;35º Simpósio Sul de Microeletrônica;SIMPÓSIO SUL DE MICROELETRÔNICA
A Comparative Analysis of Performance and Sensitivity to Radiation of XORs in 16 nm CMOS and FinFET Technologies;35º Simpósio Sul de Microeletrônica;SIMPÓSIO SUL DE MICROELETRÔNICA
Impacto de falhas transientes em memórias SRAM em nanotecnologia;CONCURSO DE TRABALHOS DE INICIAÇÃO CIENTÍFICA DA SBC (CTIC-SBC);CONCURSO DE TRABALHOS DE INICIAÇÃO CIENTÍFICA DA SBC
DESIGN AND ROBUSTNESS EVALUATION OF A 7NM FINFET DICE SRAM;Sforum - Student Forum on Microelectronics;Microelectronics Students Forum
ROBUSTNESS ANALYSIS IN SRAM BIT CELLS;Sforum - Student Forum on Microelectronics;Microelectronics Students Forum
EXPLORING DECISION TREE METHODS TO LEARN UNKNOWN BOOLEAN FUNCTIONS;Sforum - Student forum on Microlectronics;Microelectronics Students Forum
A Platform for Vehicular Networks in the Cloud to Applications in Intelligent Transportation Systems;2017 IEEE 26th International Conference on Enabling Technologies: Infrastructure for Collaborative Enterprises (WETICE);IEEE International Conference on Enabling Technologies: Infrastructure for Collaborative Enterprises
A Programmable Network Architecture for Information Centric Network using Data Replication in Private Clouds;2017 IEEE 26th International Conference on Enabling Technologies: Infrastructure for Collaborative Enterprises (WETICE);IEEE International Conference on Enabling Technologies: Infrastructure for Collaborative Enterprises
Requisitos de Segurança para Provedores de Serviços em Nuvem de Acordo com a Norma ISO 27017;Anais do I Workshop de Informação, Dados e Tecnologia (WIDAT'2017);WORKSHOP DE INFORMAÇÃO, DADOS E TECNOLOGIA
Proposta de Arquitetura de Microsserviços para um Sistema de CRM Social;Anais do I Workshop de Informação, Dados e Tecnologia (WIDAT'2017);WORKSHOP DE INFORMAÇÃO, DADOS E TECNOLOGIA
Uma Análise das Relações Existentes entre os Critérios da Qualidade da Informação e os Aspecto de Big Data;Anais do XVIII Encontro Nacional de Pesquisa em Ciência da Informação (XVIII ENANCIB);ENCONTRO NACIONAL DE PESQUISA EM CIÊNCIA DA INFORMAÇÃO
Avaliação de Desempenho de Redes SDN Utilizando Metodologia Experimental;Anais do 7o Congresso Interdisciplinar da FASETE;CONGRESSO INTERDISCIPLINAR DA FASETE
An e-Health Study Case Environment Enhanced by the Utilization of a Quality of Context Paradigm;2018 IEEE Symposium on Computers and Communications (ISCC);International Symposium on Computers and Communications
Evaluation of Cache for Bandwidth Optimization in ICN Through Software-Defined Networks;2018 IEEE Symposium on Computers and Communications (ISCC);International Symposium on Computers and Communications
Video7: An Architecture for Storage and Recovery of Streaming Audio and Video in NoSQL Database;2018 Symposium on High Performance Computing Systems (WSCAD);Simpósio em Sistemas Computacionais de Alto Desempenho
A Ciência da Informação e a Engenharia de Requisitos de Software: Convergências entre as Duas Áreas;Anais do XIX Encontro Nacional de Pesquisa em Ciência da Informação (XIX ENANCIB);ENCONTRO NACIONAL DE PESQUISA EM CIÊNCIA DA INFORMAÇÃO
Uma Análise Qualitativa dos Repositórios Digitais Arquivísticos Confiáveis (RDC-ARQ);Anais do XIX Encontro Nacional de Pesquisa em Ciência da Informação (XIX ENANCIB);ENCONTRO NACIONAL DE PESQUISA EM CIÊNCIA DA INFORMAÇÃO
Absence Forecast in Specialized Care in Public Health Units of Florianópolis;Anais do II Workshop de Informação, Dados e Tecnologia (WIDaT);WORKSHOP DE INFORMAÇÃO, DADOS E TECNOLOGIA
A Cloud Immune Security Model Based on Alert Correlation and Software Defined Network;2019 IEEE 28th International Conference on Enabling Technologies: Infrastructure for Collaborative Enterprises (WETICE);IEEE International Conference on Enabling Technologies: Infrastructure for Collaborative Enterprises
A Novel Immune Detection Approach Enhanced by Attack Graph Based Correlation;2019 IEEE Symposium on Computers and Communications (ISCC);International Symposium on Computers and Communications
A Method to Estimate Entity Performance from Mentions to Related Entities in Texts on the Web;Proceedings of the 21st International Conference on Information Integration and Web-based Applications &amp,amp, Services;International Conference on Information Integration and Web-based Applications & Services
Investigação do Impacto de Frameworks de Desenvolvimento de Software na Segurança de Sistemas Web;3º Workshop Regional de Segurança da Informação e de Sistemas Computacionais (WRSeg 2018);WORKSHOP REGIONAL DE SEGURANÇA DA INFORMAÇÃO E DE SISTEMAS COMPUTACIONAIS
Use case or activity diagram, that is the question!;Proceedings of the XVIII Brazilian Symposium on Software Quality - SBQS&amp,apos,19;Simpósio Brasileiro de Qualidade de Software
Private Verification of Access on Medical Data: An Initial Study;Data Privacy Management, Cryptocurrencies and Blockchain Technology. ESORICS 2017, DPM 2017, CBT 2017;European Symposium on Research in Computer Security
A GESTÃO UNIVERSITÁRIA EM UMA PERSPECTIVA SÓCIO-TÉCNICA SOBRE O USO DA CERTIFICAÇÃO DIGITAL EM NUVEM NA UNIVERSIDADE FEDERAL DE SANTA CATARINA, SEGUNDO AS NORMATIVAS 06 E 10 DE 2017 DO INSTITUTO NACIONAL DE TECNOLOGIA DA INFORMAÇÃO.;Anais dos Colóquios Internacionais sobre Gestão Universitária - CIGU;COLÓQUIOS INTERNACIONAIS SOBRE GESTÃO UNIVERSITÁRIA
Tuning the Winternitz hash-based digital signature scheme;2018 IEEE Symposium on Computers and Communications (ISCC);International Symposium on Computers and Communications
Processamento Distribuído de Grafos: Modelagem de Desempenho e Escalonamento de Tarefas Moldáveis;Anais do Simpósio Brasileiro de Redes de Computadores e Sistemas Distribuídos (SBRC);Simpósio Brasileiro de Redes de Computadores e Sistemas Distribuídos
Performance Modeling and Task Scheduling in Distributed Graph Processing;Proceedings: 2018 IEEE International Congress on Big Data;IEEE International Congress on Big Data
Semantic Data-Driven Microservices;2019 IEEE 43rd Annual Computer Software and Applications Conference (COMPSAC);Annual International Computers, Software & Applications Conference
Semantic Enrichment of Services for Linked Data Provision in SOA;Proceedings of the XV Brazilian Symposium on Information Systems - SBSI'19;Simpósio Brasileiro de Sistemas de Informação
Scalable Precondition-Aware Service Composition with SPARQL;Proceedings of the 2019 IEEE Symposium on Computers and Communications;International Symposium on Computers and Communications
Providing Data Integrity in Graph Databases;2019 XLV Latin American Computing Conference (CLEI);Conferencia Latinoamericana de Informática
How Game Engines Can Inspire EDA Tools Development;Proceedings of the 2017 ACM on International Symposium on Physical Design - ISPD '17;ACM International Symposium on Physical Design
On the calculation reuse in hadamard-based SATD;2018 IEEE 9th Latin American Symposium on Circuits &amp,amp, Systems (LASCAS);IEEE Latin American Symposium on Circuits and Systems
Ophidian: an Open-Source Library for Physical Design Research and Teaching;2018 Workshop on Open-Source EDA Technology (WOSET 2018);WORKSHOP ON OPEN-SOURCE EDA TECHNOLOGY
How Deep Learning Can Drive Physical Synthesis Towards More Predictable Legalization;Proceedings of the 2019 International Symposium on Physical Design - ISPD &amp,apos,19;ACM International Symposium on Physical Design
A Soft Real-Time Scheduling Engine for Cost Reduction in Freemium Companies;IEEE ISORC 2017 (20th IEEE International Symposium on Real-Time Computing);IEEE International Symposium on RealTime Distributed Computing
Uma Plataforma de Tempo Real para Priorização de Serviços de IoT na Nuvem;Proceedings of VII Brazilian Symposium on Computing Systems Engineering;Brazilian Symposium on Computing System Engineering
Koordinator: A Service Approach for Replicating Docker Containers in Kubernetes.;Proceedings of the 23th IEEE Symposium on Computers and Communications;International Symposium on Computers and Communications
A Method to Verify Data Integrity in Graph Databases;Proceedings of the 22th IEEE Symposium on Computers and Communications;International Symposium on Computers and Communications
REPO: A Microservices Elastic Management System for Cost Reduction in the Cloud;Proceedings of the 22th IEEE Symposium on Computers and Communications;International Symposium on Computers and Communications
Experimental Evaluation of the Coexistence of IEEE 802.11 EDCA and DCF Mechanisms;Proceedings of the 22th IEEE Symposium on Computers and Communications;International Symposium on Computers and Communications
Interference of IEEE 802.11n Networks upon IEEE 802.15.4-Based WBANs: An Experimental Study;Proceedings of the 16th International Conference of Industrial Informatics;IEEE International Conference on Industrial Informatics
Policy-Based Adaptation of a Byzantine Fault Tolerant Distributed Graph Database;Proceedings of 37th IEEE International Symposium on Reliable Distributed Systems;IEEE Symposium on Reliable Distributed Systems
Avaliação Experimental do Protocolo RT-WiFi em Ambientes Abertos;XXXVII Simpósio Brasileiro de Redes de Computadores (SBRC);Simpósio Brasileiro de Redes de Computadores e Sistemas Distribuídos
Constantino: Uma Arquitetura BFT Escalável e Eficiente para Blockchains;XXXVII Simpósio Brasileiro de Redes de COmputadores;Simpósio Brasileiro de Redes de Computadores e Sistemas Distribuídos
HRM Smart Contracts on the Blockchain;Proceedings of 24th IEEE SYMPOSIUM ON COMPUTERS AND COMMUNICATIONS 2019;International Symposium on Computers and Communications
RT-WiFi Approach to Handle Real-Time Communication: An Experimental Evaluation;International Conference on Ad-Hoc Networks and Wireless (ADHOC-NOW 2019);OW - International Conference on Ad-Hoc Networks and Wireless
Provendo Integridade de Dados em Bancos de Dados de Grafos.;Proceedings of XLV Conferência Latino-Americana de Informática;Conferencia Latinoamericana de Informática
Coordenação de Containers no Kubernetes: Uma Abordagem Baseada em Serviço;Proceedings of 35th Simpósio Brasileiro de Redes de Computadores;Simpósio Brasileiro de Redes de Computadores e Sistemas Distribuídos
Steep coverage-ascent directed test generation for shared-memory verification of multicore chips;Proceedings of the International Conference on Computer-Aided Design - ICCAD '18;IEEE/ACM International Conference on ComputerAided Design
Spec&amp,amp,Check: An Approach to the Building of Shared-Memory Runtime Checkers for Multicore Chip Design Verification;2019 IEEE/ACM International Conference on Computer-Aided Design (ICCAD);IEEE/ACM International Conference on ComputerAided Design
A Reinforcement Learning Approach to Directed Test Generation for Shared Memory Verification;2020 Design, Automation &amp,amp, Test in Europe Conference &amp,amp, Exhibition (DATE);Design, Automation and Test in Europe Conference and Exhibition
RMem: An OS Service for Transparent Remote Memory Access in Lightweight Manycores;Proceedings of the International Workshop on Programmability and Architectures for Heterogeneous Multicores (MULTIPROG);WORKSHOP ON PROGRAMMABILITY AND ARCHITECTURES FOR HETEROGENEOUS MULTICORES
The Hardware Abstraction Layer of Nanvix for the MPPA-256 Lightweight Manycore Processor;Actes de la Conférence d'Informatique en Parallélisme, Architecture et Système (COMPAS);CONFÉRENCE D'INFORMATIQUE EN PARALLÉLISME, ARCHITECTURE ET SYSTÈME
Distributed Memory Graph Representation for Load Balancing Data: Accelerating Data Structure Generation for Decentralized Scheduling;2019 International Conference on High Performance Computing &amp,amp, Simulation (HPCS);International Conference on High Performance Computing & Simulation
On the Performance and Isolation of Asymmetric Microkernel Design for Lightweight Manycores;2019 IX Brazilian Symposium on Computing Systems Engineering (SBESC);Brazilian Symposium on Computing System Engineering
Combined Convolutional Neural Network for High Frequency Restoration in Acoustic Impedance Images;2018 International Joint Conference on Neural Networks (IJCNN);IEEE International Joint Conference on Neural Networks
Adaptive Missing Data Imputation with Incremental Neuro-Fuzzy Gaussian Mixture Network (INFGMN);2018 International Joint Conference on Neural Networks (IJCNN);IEEE International Joint Conference on Neural Networks
Efficient 3D Semantic Segmentation of Seismic Images using Orthogonal Planes 2D Convolutional Neural Networks;2020 International Joint Conference on Neural Networks (IJCNN);IEEE International Joint Conference on Neural Networks
Assessing the Performance of the SRR Loop Scheduler;Proceedings of the International Conference on Computational Science (ICCS);International Conference on Computational Science
Towards the Use of LITMUS-RT as a Testbed for Multiprocessor Scheduling in Energy Harvesting Real-time Systems;Proceedings of the Brazilian Symposium on Computing Systems Engineering (SBESC);Brazilian Symposium on Computing System Engineering
An Overview on Real-Time Constraints for Ambient Intelligence (AmI);15th ACS/IEEE International Conference on Computer Systems and Applications AICCSA 2018;ACS/IEEE International Conference on Computer Systems and Applications
NewSQL Through the Looking Glass;Proceedings of the 21st International Conference on Information Integration and Web-based Applications &amp, Services (iiWAS2019);International Conference on Information Integration and Web-based Applications & Services
LCCSS;Proceedings of the 14th Brazilian Symposium on Software Components, Architectures, and Reuse;BRAZILIAN SYMPOSIUM ON SOFTWARE COMPONENTS, ARCHITECTURES, AND REUSE
A preliminary study on using acceptance tests for representing business requirements of smart contracts;2020 IEEE International Conference on Blockchain and Cryptocurrency (ICBC);IEEE INTERNATIONAL CONFERENCE ON BLOCKCHAIN AND CRYPTOCURRENCY
Mapeamento de Critérios de Aceitação de Transparência de Software para Testes Automatizados;Anais do 23o. Congresso Ibero-americano de Engenharia de Software (CIbSE 2020) - Trilha de Engenharia de Software (SET);Conferencia Iberoamericana de Software Engineering
Effective Ant Colony Optimization Solution for the Brazilian Family Health Team Scheduling Problem;2018 IEEE 30th International Conference on Tools with Artificial Intelligence (ICTAI);IEEE International Conference on Tools with Artificial Intelligence
